{"action":"publish","branch":"main","ended_at":"2026-09-01T11:32:23.634913Z","failure_class":"commit_rejected","manifest_sha256":"3a69df680218b0c139981b1d04e28532c52875650fd43a01f368793f7cb8f818","new_revision":null,"new_tree_sha256":null,"packaging_commit":"0007af3dbaff45c0af0308258ffc3f46a0b3239f","parent_revision":"90cb95cbf46ef0fd24dec521d5274ab0b9c50976","parent_tree_sha256":"3872a07140ef2adcf31a7ea8b3014519784e7421b3241c6cefbd10a6c821c7c4","prior_revision":"90cb95cbf46ef0fd24dec521d5274ab0b9c50976","prior_tree_sha256":"3872a07140ef2adcf31a7ea8b3014519784e7421b3241c6cefbd10a6c821c7c4","receipt_sha256":"214a629180534d9b419598874df6cd357da6117417f7192f5959b7f5b5443cb9","release_source_commit":"790c566","release_source_metadata_path":"project/static/version.json","release_source_metadata_sha256":"e8d5aa8594a2340d77d59a45980da5932ac77f5bf7daab6a85ea57df2c3a2f0e","release_source_revision":"790c5660cdb99295a42a50fae1259f2e87eacbec","repo_type":"space","schema_version":1,"sdk":"docker","space_id":"pphothidaen/horoconsultant-core-backend","started_at":"2026-09-01T10:26:46.409332Z","status":"FAILED","total_bytes":53978485,"total_files":863,"version":"1.0.0.790c566"}
